bill_number,name,description,floor_vote_date
HB2001,The Everything Act,"It does everything, but fixes nothing.",3/13/2014
HB2002,Guns in Everywhere,"Guns everywhere, except the legislature.",3/14/2014
HB2003,No Sales Taxes Ever,Because we don't need to fund programs.,3/15/2014
HB2004,All Charters Act,All schools should be for-profit.,3/16/2014
SB1234,Wine in Grocery Stores,Because it makes sense.,3/17/2014
SB1235,Nashville Has to Ask,Nashville has to get permission first for everything.,3/18/2014